{
  "protocol_version": 1,
  "type": "chat.message",
  "room_id": 1,
  "hand_id": 41,
  "version": 18,
  "server_time": "2026-10-27T14:03:12.400Z",
  "payload": {
    "message": {
      "message_id": 9,
      "player_id": "2",
      "display_name": "An",
      "text": "bluff à 😏",
      "sent_at": "2026-10-27T14:03:12.398Z"
    }
  }
}
